Section,Narrative
Generation Summary,The Khavda Renewable Energy Park has successfully produced 221231.61 MW of renewable energy over the reporting period.
Revenue Summary,Financial performance remains solid with total revenue tracking at 99.55 Crores INR.
Risk Summary,"Operations experienced 3 high-risk weather days, resulting in an estimated 1.45 Crores INR of revenue exposed to weather-related risks."
Sustainability Summary,"The facility continues to drive massive decarbonization, avoiding 93662.26 Tons of CO2 equivalent emissions."
Forecast Summary,AI-driven forecasting models remain accurate with an average predictive error of 53.53%.
AI Insights Summary,"Dynamic predictive models indicate a generally favorable operating environment, with isolated generation drops correlated strictly to transient cloud cover and heavy rainfall."
